<!DOCTYPE db [
<!ELEMENT db (pessoa+)>
<!ELEMENT pessoa (nome, idade, email+, telefone?)>
<!ELEMENT nome (#PCDATA)>
<!ELEMENT idade (#PCDATA)>
<!ELEMENT email (#PCDATA)>
<!ELEMENT telefone (#PCDATA)>
]>
